"Weitong Chen, Sen Wang, Guodong Long, Lina Yao, Quan Zheng Sheng, and Xue Li",Dynamic Illness Severity Prediction via Multi-task RNNs for Intensive Care Unit, IEEE International Conference on Data Mining ( ICDM 2018),"Singapore", November 17-20, 2018
"Dalin Zhang, Lina Yao, Kaixuan Chen, Sen Wang",Ready for Use: Subject-Independent Movement Intention Recognition via A Convolutional Attention Model, The 27th ACM Conference on Information and Knowledge Management ( CIKM 2018),"Lingotto, Turin, Italy", October 22 - 26, 2018
"Xiang Zhang, Lina Yao, Salil.S. Kanhere, Yunhao Liu, Tao Gu and Kaixuan Chen",MindID: Person Identification from Brain Waves through Attention-based Recurrent Neural Networ,arXiv(accepted by IMWUT/Ubicomp 2018)
"Dalin Zhang, Lina Yao, Sen Wang, Kaixuan Chen, Zheng Yang and Boualem Benatallah",Fuzzy Integral Optimization with Deep Q-Network for EEG-based Intention Recognition, The 22nd Pacific-Asia Conference on Knowledge Discovery and Data Mining (PAKDD 2018),"Melbourne, Australia", June 3 - 6, 2018
"Dalin Zhang, Lina Yao, Xiang Zhang, Sen Wang, Weitong Chen and Robert Boots",EEG-based Intention Recognition from Spatio-Temporal Representations via Cascade and Parallel Convolutional Recurrent Neural Networks,arXiv(accepted by AAAI-18)
"Xiang Zhang, Lina Yao, Dalin Zhang, Xianzhi Wang, Quan Z. Sheng and Tao Gu",Multi-Person Brain Activity Recognition via Comprehensive EEG Signal Analysis, The 14th International Conference on Mobile and Ubiquitous Systems: Computing, Networking and Services (Mobiquitous 2017),"Melbourne, Australia", Nov 7 - 10, 2017
"Xiang Zhang, Lina Yao, Chaoran Huang, QuanZheng Sheng and Xianzhi Wang",Intent Recognition in Smart Living Through Deep Recurrent Neural Networks, The 24th International Conference On Neural Information Processing (ICONIP 2017),"Guangzhou, China", November 14-18, 2017
"Xiang Zhang, Lina Yao, Quan Z. Sheng, Salil S. Kanhere, Tao Gu and Dalin Zhang", Converting Your Thougts to Texts: Enabling Brain Typing via Deep Feature Learning of EEG Signals,arXiv(accepted by Percom 2018)